[
  {
    "id": "test-001",
    "script": "echo 'Hello from ghostOS-kernel daemon!'",
    "status": "done",
    "created": "2025-06-29 14:30:00",
    "last_run": "2025-06-29 14:35:00"
  },
  {
    "id": "test-002",
    "script": "false",
    "status": "failed",
    "created": "2025-06-29 14:36:00",
    "last_run": "2025-06-29 14:35:00"
  }
]